{
  "$schema": "../_schema.json",
  "format": "pptx",
  "element": "group",
  "parent": "slide",
  "operations": {
    "add": true,
    "set": true,
    "get": true,
    "query": true,
    "remove": true
  },
  "paths": {
    "positional": ["/slide[N]/group[M]"]
  },
  "note": "Groups existing shapes on a slide. 'shapes' takes comma-separated shape indices or DOM paths. Group bounding box auto-computed from member transforms. Shapes inside a group are addressable via /slide[N]/group[M]/shape[K] for direct Set/Get.",
  "properties": {
    "shapes": {
      "type": "string",
      "description": "comma-separated shape indices (1,2,3) or paths (/slide[N]/shape[M] or /slide[N]/shape[@id=ID]). Required.",
      "add": true, "set": false, "get": false,
      "examples": ["--prop shapes=1,2"],
      "readback": "n/a (structural)",
      "enforcement": "report"
    },
    "name": {
      "type": "string",
      "description": "group name. Defaults to 'Group N'.",
      "add": true, "set": true, "get": true,
      "examples": ["--prop name=\"Logos\""],
      "readback": "name string",
      "enforcement": "report"
    },
    "zorder": {
      "type": "number",
      "description": "1-based z-order in slide shape tree.",
      "add": false, "set": false, "get": true,
      "readback": "1-based integer (1 = back)",
      "enforcement": "report"
    }
  }
}
